probe_path,local_artifact,exists,can_run_original_game,can_dump_ui_stack,can_recover_depth_algorithm,can_recover_uispine_renderer,risk_or_blocker,decision
IL2CPP DummyDll + script.json static trace,C:\Users\godho\Downloads\girlswar\girlswar_merged_extracted\extracted\il2cpp_dump\DummyDll\Assembly-CSharp.dll; C:\Users\godho\Downloads\girlswar\girlswar_merged_extracted\extracted\il2cpp_dump\script.json,True,False,False,partial_signature_only,partial_signature_and_serialized_refs_only,DummyDll has fields/signatures/RVAs but empty method bodies; native lib analysis or live runtime needed for formulas.,use_as_static_evidence_not_patch_basis
Original APK local launch/instrumentation,C:\Users\godho\Downloads\girlswar\girlswar_merged_extracted\split_apks\com.girlwars.kr.apk,True,not_in_current_windows_shell_without_android_runtime,feasible_only_with_safe_android_emulator/device_and_instrumentation,yes_if_runtime_dump_hooks_GameEntry_UI_YouYouCanvasHelper,yes_if_runtime_dump_hooks_UISpineCtr_and_serialized_SkeletonGraphic,No configured emulator/device/runtime hook in this task; launching/instrumenting original app is outside current no-patch local Unity rebuild flow.,blocked_pending_user_approved_runtime_dump_environment
Native libil2cpp/global-metadata reverse trace,C:\Users\godho\Downloads\girlswar\il2cpp_native\libil2cpp.so; C:\Users\godho\Downloads\girlswar\il2cpp_native\global-metadata.dat,True,False,False,possible_with_native_disassembly_but_not_completed_here,possible_with_native_disassembly_but_not_runtime_state,Would need native IL2CPP method body analysis at RVAs from DummyDll; current evidence does not yet recover formulas safely.,next_static_deep_dive_candidate_not_scene_patch
Unity project candidate replay,C:\Users\godho\Downloads\girlswar\girlswar_maininterface_unity,True,False,static_candidate_only,no_without_reimplementing_UIManager_or_loading_original_runtime,no_for_UI_Dock_sp_until_custom_component_and_assets_are_bound,UI136 capture proved simple source-built sibling mount worsens metrics; current project does not execute original YouYouUIManager/UISpineCtr runtime path.,trace_only_no_candidate_promotion
External xLua/package import,not used,False,False,False,False,False,Forbidden without explicit user approval.,forbidden
