candidateId,category,exactObjectOrField,sourceEvidence,classification,proposedExactChange,blockedOrForbiddenReason,verificationPlanId
map_layer_reprojection_true_aspect,wrong_render_framing_black_gutters,BattleCorrectMapSceneHudPreviewClip05Root/Map_11003_* Transform.localPosition derived by CreateMapLayerPixel,BATTLE27 editor code uses Map_11003 source sprites and 1920x1080 pixel-to-world projection; BATTLE69 measured 200px/27px true-aspect gutters,safe_source_backed_patch_candidate,candidate-only patch: reproject Map_11003 layer positions from the same pixel-space source rows for 1920x855/reference view rect; save only a candidate scene if later task approves,,verify_true_aspect_gutter_after_map_reprojection
camera_ortho_position_or_pixelrect_adjust,wrong_render_framing_black_gutters,BattleHudSpriteAtlasTextureRuntimeBindingClip05Camera orthographicSize/aspect/pixelRect/targetTexture,BATTLE68 camera orthoSize=5 and pixelRect=0/0/640/480; no original runtime camera framing metadata found in this task,analysis_only,"do not change camera before isolating map reprojection, because it can move HUD, actors, and raycast coordinates together",camera-only change would be coordinate-only without original camera evidence,compare_camera_vs_map_delta_if_needed
top_hud_right_rail_active_state,route_hud_layout,"root_top/TopCenter, root_opra buttons and im_on/im_off children",UI_NormalBattle.lua controls these states through ModulesInit.ProcedureNormalBattle and LuaUtils.SetActive/SetChildActive,needs_runtime_or_handler_evidence,none,xLua/GameEntry/ModulesInit runtime is unavailable; active state cannot be guessed,verify_after_original_runtime_or_source_state_evidence
right_rail_rect_transform_coordinate_patch,route_hud_layout,btnAuto/btnTwoSpeed/btnFastSkill/btnSkip/btnPause RectTransform anchors/positions,BATTLE54 route rows show current values; no separate original rect delta proving a correction was found,forbidden_guess,none,coordinate-only patch is forbidden and would hide runtime state problems,
bottom_five_card_assembly,card_payload,bottom card container / five-card expected region,"BATTLE69 bottom card mismatch and BATTLE54 active card rows only prove local subset, not full card assembly",blocked_by_payload,none in BATTLE70,card/icon/payload completion remains separate; fake card/icon is forbidden,verify_after_payload_chain
full_actor_formation_payload,actor_payload,1036 and unresolved enemy actor ids,"CHARACTER65/BATTLE69: ready actors 3, source-known missing 1036, unresolved enemies remain",blocked_by_payload,none in BATTLE70,BATTLE57 local subset actors are visible but full formation is not source-complete,verify_after_actor_bundle_chain
